Character	Lines	Game Designer Notes	Filename	Voice Talent Notes
Medi	I'm not so sure about that		Medi_a	
Medi	That sounds like a plan		Medi_b	
Medi	What do you think we should do		Medi_c	
Medi	What was that?	Curious, not too alarmed	Medi_d	
Medi	Be quiet, I see gaurds on patrol	Quiet but serious	Medi_e	
Samsel	The way that can be named is not the true way		Samsel_a	
Samsel	The answer you seek is already within you		Samsel_b	
Samsel	To go forward, you must go back		Samsel_c	
Samsel	The obstable is the way		Samsel_d	